<?xml version="1.0"?>
<!--
 * Licensed to the Apache Software Foundation (ASF) under one
 * or more contributor license agreements.  See the NOTICE file
 * distributed with this work for additional information
 * regarding copyright ownership.  The ASF licenses this file
 * to you under the Apache License, Version 2.0 (the
 * "License"); you may not use this file except in compliance
 * with the License.  You may obtain a copy of the License at
 * 
 *   http://www.apache.org/licenses/LICENSE-2.0
 * 
 * Unless required by applicable law or agreed to in writing,
 * software distributed under the License is distributed on an
 * "AS IS" BASIS, WITHOUT WARRANTIES OR CONDITIONS OF ANY
 * KIND, either express or implied.  See the License for the
 * specific language governing permissions and limitations
 * under the License.    
-->
<ipo:purchaseOrder
  xmlns:xsi="http://www.w3.org/2001/XMLSchema-instance"
  xmlns:ipo="http://www.example.com/IPO"
  xsi:schemaLocation="http://www.example.com/IPO ipo.xsd"
  orderDate="1999-12-01">

  <shipTo exportCode="1" xsi:type="ipo:UKAddress">
    <name>Helen Zoe</name>
    <street>47 Eden Street</street>
    <city>Cambridge</city>
    <postcode>CB1 1JR</postcode>
  </shipTo>

  <billTo xsi:type="ipo:USAddress">
    <name>Robert Smith</name>
    <street>8 Oak Avenue</street>
    <city>Old Town</city>
    <state>PA</state>
    <zip>95819</zip>
  </billTo>

  <items>
    <item partNum="833-AA">
      <productName>Lapis necklace</productName>
      <quantity>1</quantity>
      <USPrice>99.95</USPrice>
      <ipo:comment>Want this for the holidays</ipo:comment>
      <shipDate>1999-12-05</shipDate>
    </item>
  </items>
</ipo:purchaseOrder>

